{
  "$schema": "https://the-gomps.github.io/gomps-game-settings/gomps-settings-schema.json",
  "BaseScale": 2,
  "LocalPlayer": {
    "Include": [
      {
        "ObjectName": "Player0",
        "ChildPath": "PlayerSprite/HeadPosition"
      }
    ]
  },
  "Text": {
    "TextScale": 1.5
  },
  "RemotePlayer": {
    "EulerAnglesOffset": "0,130,0"
  }
}
