{
  "$schema": "https://the-gomps.github.io/gomps-game-settings/gomps-settings-schema.json",
  "BaseScale": 1,
  "LocalPlayer": {
    "Include": [
      {
        "ObjectName": "PlayerEnt",
        "ChildPath": "Ittle/ittle/Armature/root/chest/head"
      }
    ]
  },
  "Text": {
    "TextScale": 2
  },
  "RemotePlayer": {
    "EulerAnglesOffset": "0,0,90"
  }
}
