{
  "$schema": "https://the-gomps.github.io/gomps-game-settings/gomps-settings-schema.json",
  "BaseScale": 1,
  "LocalPlayer": {
    "Include": [
      {
        "Component": "Gris.CharacterController2D",
        "ChildPath": "Sprite"
      }
    ]
  },
  "MainCamera": {
    "Include": [
      {
        "ObjectName": "Main Camera(Clone)"
      }
    ]
  },
  "Text": {
    "TextScale": 2
  },
  "RemotePlayer": {
    "PositionOffset": "0,0.9,0",
    "EulerAnglesOffset": "0,130,0"
  }
}
