{
  "$schema": "https://the-gomps.github.io/gomps-game-settings/gomps-settings-schema.json",
  "BaseScale": 2,
  "LocalPlayer": {
    "Include": [
      {
        "ObjectName": "Knight"
      }
    ]
  },
  "Text": {
    "TextScale": 3
  },
  "RemotePlayer": {
    "PositionOffset": "0.0,-0.6,0.0",
    "EulerAnglesOffset": "0.0,180,0.0"
  }
}
